industry_id,industry_name,job_id,company_name,title,description,max_salary,pay_period,location,company_id,views,med_salary,min_salary,formatted_work_type,applies,original_listed_time,remote_allowed,job_posting_url,application_url,application_type,expiry,closed_time,formatted_experience_level,skills_desc,listed_time,posting_domain,sponsored,work_type,currency,compensation_type,normalized_salary,zip_code,fips
4,Software Development,3901394150,DataAnnotation,Frontend Developer,"DataAnnotation is committed to creating quality AI. Join our team to help train AI chatbots while gaining the flexibility of remote work and choosing your own schedule.
We are looking for a proficient Frontend Developer to join our team to train our AI chatbots to code. You will work with the chatbots that we are building in order to measure their progress, as well as write and evaluate code.
In this role you will need to be proficient in at least one programming language (Python, JavaScript, HTML, C++, C# and SQL) and able to solve coding problems (think LeetCode, HackerRank, etc). For each coding problem, you must be able to explain how your solution solves the problem.
Benefits:
This is a full-time or part-time REMOTE positionYou’ll be able to choose which projects you want to work onYou can work on your own scheduleProjects are paid hourly, starting at $40+ USD per hour, with bonuses for high-quality and high-volume work
Responsibilities:
Come up with diverse problems and solutions for a coding chatbotWrite high-quality answers and code snippetsEvaluate code quality produced by AI models for correctness and performance
Qualifications:
Fluency in English (native or bilingual)Proficient in at least one programming language (Python, JavaScript, HTML, C++, C# and SQL)Excellent writing and grammar skillsA bachelor's degree (completed or in progress)
Note: Data Annotation payment is made via PayPal. We will never ask for any money from you. PayPal will handle any currency conversions from USD.",,,Raleigh-Durham-Chapel Hill Area,96139831.0,72.0,,,Contract,11.0,1713461562000.0,1.0,https://www.linkedin.com/jobs/view/3901394150/?trk=jobs_biz_prem_srch,https://app.dataannotation.tech/worker_signup?projects=PROG_SA&worker_src=L&utm_medium=display&utm_source=linkedin&utm_campaign=softwaredeveloper,OffsiteApply,1716053562000.0,,,,1713461562000.0,,0,CONTRACT,,,,,
4,Software Development,3901941095,DataAnnotation,Copywriter,"DataAnnotation is committed to creating quality AI. Join our team to help train AI chatbots while gaining the flexibility of remote work and choosing your own schedule.
We are looking for a Copywriter to join our team and teach AI chatbots. You will have conversations with chatbots in order to measure their progress, as well as write novel conversations in order to teach them what to say.
Benefits:
This is a full-time or part-time REMOTE positionYou’ll be able to choose which projects you want to work onYou can work on your own scheduleProjects are paid hourly, starting at $20+ USD per hour, with bonuses for high-quality and high-volume work
Responsibilities:
Come up with diverse conversations over a range of topicsWrite high-quality answers when given specific promptsCompare the performance of different AI modelsResearch and fact-check AI responses
Qualifications:
Fluent in EnglishA bachelor's degree (completed or in progress)Excellent writing and grammar skillsStrong research and fact-checking skills to ensure accuracy and originality
Note: Data Annotation payment is made via PayPal. We will never ask for any money from you. PayPal will handle any currency conversions from USD.",,,"Alpharetta, GA",96139831.0,6.0,,,Contract,,1713466848000.0,1.0,https://www.linkedin.com/jobs/view/3901941095/?trk=jobs_biz_prem_srch,https://app.dataannotation.tech/worker_signup?worker_src=LI&utm_medium=display&utm_source=linkedin&utm_campaign=aicontentwriter,OffsiteApply,1716058847000.0,,,,1713466848000.0,,0,CONTRACT,,,,30004.0,
4,Software Development,3901362995,Okta,"Creative Lead, Presentation Design","Get to know Okta

Okta is The World’s Identity Company. We free everyone to safely use any technology—anywhere, on any device or app. Our Workforce and Customer Identity Clouds enable secure yet flexible access, authentication, and automation that transforms how people move through the digital world, putting Identity at the heart of business security and growth.

At Okta, we celebrate a variety of perspectives and experiences. We are not looking for someone who checks every single box - we’re looking for lifelong learners and people who can make us better with their unique experiences.

Join our team! We’re building a world where Identity belongs to you.

About Our Team

The Studio team at Okta is a growing group within Marketing, composed of creatives, strategists, producers and marketing managers alike. Our team’s focus is to lead the brand, tell powerful stories and inspire creative excellence.

As a partner to cross-functional teams across all of Okta, we tie our goals to our most important company initiatives, driving towards shared KPIs, strategies and processes to unify and push the brand and business forward.

About This Role

Okta is looking for an exceptional Creative Lead to manage and lead Presentation Design. This is a role for a unique, inspiring creative that has a passion for storytelling and design, helping our organization and executive leadership team communicate at their best. This role requires experience, ability and drive to manage multiple projects and creative teams and work seamlessly with cross-functional leaders across the company. This role requires a strong presentation design background and hyper focus and understanding of all things design.

What You Will Do

Partner closely with Okta’s executive leadership team and comms leads to understand needs and help to guide and build strong presentation narratives through content and designOnboard and manage creative agencies specializing in presentation design to help with high-volume moments in the MKTG calendar such as major eventsMaintain and evolve our branded company wide presentation systemHelp to evolve the visual language of the Okta brand through presentation design; ensure the consistency of the brand and highest quality of design across all projectsCreate, concept, inspire others; help to execute the work while bringing design and branding ideas to lifeKeen understanding and passion to learn about and share insights on design and industry trendsHelp to simplify and translate complex ideas through effective storytelling and design; clear understanding of storytelling principles and ability to build a strong visual narrativeCan deliver direct and inspired feedback to the team and agency partnersMust be a self starter while being comfortable guiding teams, freelancers, agencies, and production partners

What Experience You Have

BA or BFA in Art/DesignExtraordinary design skillsWorld-class portfolio of workExpert knowledge of creative process and all digital creative software tools; highly proficient in PowerPoint, Keynote, and Google Slides10+ years experience in art direction and design in a creative agency or client-side group; experience working with B2B / technology brands is a plus5+ years experience leading and managing a team in a creative agency or internal creative group; global experience is a plus8+ years experience in presentation design for a creative agency or internal creative groupHands-on expertise in developing creative presentation solutions across key marketing programs, e.g. events, internal comms, etc.

You are excited about this role because:

You are highly motivated and a problem solver.You love to build teams and process.You never shy from a challenge.

We are excited about you because:

You are an inspiring, positive creative leader and understand the value and power of storytelling through presentation design.You are always bringing new ideas to the table.You are happy to share your knowledge and insights with other team members.

Below is the annual base salary range for candidates located in California, Colorado, New York and Washington. Your actual base salary will depend on factors such as your skills, qualifications, experience, and work location. In addition, Okta offers equity (where applicable), bonus, and benefits, including health, dental and vision insurance, 401(k), flexible spending account, and paid leave (including PTO and parental leave) in accordance with our applicable plans and policies. To learn more about our Total Rewards program please visit: https://rewards.okta.com/us.

The annual base salary range for this position for candidates located in California (excluding San Francisco Bay Area), Colorado, New York, and Washington is between:

$142,000—$212,000 USD

The annual base salary range for this position for candidates located in the San Francisco Bay area is between:

$158,000—$238,000 USD

What you can look forward to as an Full-Time Okta employee!

Amazing BenefitsMaking Social ImpactFostering Diversity, Equity, Inclusion and Belonging at Okta 

Okta cultivates a dynamic work environment, providing the best tools, technology and benefits to empower our employees to work productively in a setting that best and uniquely suits their needs. Each organization is unique in the degree of flexibility and mobility in which they work so that all employees are enabled to be their most creative and successful versions of themselves, regardless of where they live. Find your place at Okta today! https://www.okta.com/company/careers/.

Okta is an Equal Opportunity Employer. All qualified applicants will receive consideration for employment without regard to race, color, religion, sex, sexual orientation, gender identity, national origin, ancestry, marital status, age, physical or mental disability, or status as a protected veteran. We also consider for employment qualified applicants with arrest and convictions records, consistent with applicable laws. If reasonable accommodation is needed to participate in the job application or interview process, please use this Form to request an accommodation.

Okta is committed to complying with applicable data privacy and security laws and regulations. For more information, please see our Privacy Policy at https://www.okta.com/privacy-policy/.

",,,United States,926041.0,26.0,,,Full-time,6.0,1713398400000.0,1.0,https://www.linkedin.com/jobs/view/3901362995/?trk=jobs_biz_prem_srch,https://www.okta.com/company/careers/opportunity/5913611?gh_jid=5913611&gh_src=7j0um41,OffsiteApply,1716048158000.0,,,,1713456158000.0,www.okta.com,0,FULL_TIME,,,,,
4,Software Development,3884811465,SecureKloud Technologies,Information Technology Support Technician,"

Job Title: IT Support Analyst
Long term contract
Mission Hills CA - ONSITE 


this is a long term contract and may extend as needed
Able Lift 50 LB or more (printers or other equipment as needed)
Drive to support and\or Cover tech that may call out on the last mins
Can transport equipment from one site to next site.
Work hours 8 AM and end 5 PM with 1 hour lunch.
As needed, work after hours (Cut Over is 5PM and start late like 12PM to when project end) will get full 8 hours.
As needed, come in next day before 6AM Go-Live support.
As needed, work on the Saturday or Sunday and take 1 or 2 days off during the week to make 40 hours week






With Regards, 
Senthil 

SecureKloud Technologies Inc., 

Direct : 214-613-0887 

Email : senthilbabu.s@securekloud.com 

LinkedIn : linkedin.com/in/senthil-babu-r-57059754

Website : www.securekloud.com",,,"Los Angeles, California, United States",71602553.0,7.0,,,Contract,2.0,1712368460000.0,,https://www.linkedin.com/jobs/view/3884811465/?trk=jobs_biz_prem_srch,,SimpleOnsiteApply,1714960460000.0,,,,1712368460000.0,,0,CONTRACT,,,,,
4,Software Development,3905394682,New Relic,"Lead Software Development Engineer, Developer Platform Team - Golang (Remote)","Your opportunity
If you are driven by innovation, passionate about technical excellence, and ready to collaborate with a team of exceptional engineers, apply now for this position at New Relic. Let's embark on an exciting journey of innovation and technical advancements together!

At New Relic, we provide businesses with a state-of-the-art observability platform, leveraging advanced technologies to deliver real-time insights into the performance of software applications and infrastructure. As a company at the forefront of the industry, we enable organizations to monitor, analyze, and optimize their systems to achieve enhanced reliability, performance, and user experience. Join us in our mission to revolutionize observability and empower businesses in today's dynamic digital landscape.

What you'll do

Lead and build a scalable developer platform with DevSecOps capabilities to assist engineering teams in developing and deploying secure software.Partner with Product Managers, Engineering Managers and peer engineers to deliver and exceed business goals.Lead the architectural and design definitions with a high degree of innovation and creativity.Create the infrastructure and framework needed to make our systems more scalable and simpler to deploy.Research new frameworks and services to understand sophisticated scenarios and propose new features based on the learning.Work in an agile environment with a DevSecOps approach—teams build and maintain their own secure software, including taking turns with being on-call.


This role requires

Bachelor's degree in Computer Science or equivalent.8+ years of hands-on professional experience with distributed systems, concurrency, and scaling in a production environment.Proficient in writing software using Golang, React, Groovy or other object-oriented languages (C++, Python, etc) and you are not afraid of adapting, learning, and working with different languages and frameworks.Experience with Docker (optimizing image size, multi-arch, multi-stage, and BuildKit) and K8S.Experience with security scanning tools like trivy, Snyk, etc.Experience with administering systems like GitHub enterprise, Artifactory, etc.Comfortable in a fast-paced environment passionate about delivering production code at a regular cadence using Agile techniques, tools and methodologies.Having a collaborative work style that includes colleagues in important decisions and leads to shared code ownership


Bonus points if you have

Contribution to open source projects.Familiarity with Terraform, Jenkins, AWS Services (EKS, EC2, etc)Familiarity with language dependency/package tooling such as Gradle / Maven, pip, Rubygems, and npm / yarnUnderstanding the value that DevSecOps practices brings to a development team's efficiency and reliability and are passionate about applying these techniques to your projects.


Fostering a diverse, welcoming and inclusive environment is important to us. We work hard to make everyone feel comfortable bringing their best, most authentic selves to work every day. We celebrate our talented Relics’ different backgrounds and abilities, and recognize the different paths they took to reach us – including nontraditional ones. Their experiences and perspectives inspire us to make our products and company the best they can be. We’re looking for people who feel connected to our mission and values, not just candidates who check off all the boxes.

If you require a reasonable accommodation to complete any part of the application or recruiting process, please visit https://newrelic.avature.net/accommodations to submit your request.

We believe in empowering all Relics to achieve professional and business success through a flexible workforce model. This model allows us to work in a variety of workplaces that best support our success, including fully office-based, fully remote, or hybrid.

Our hiring process

Please note that visa sponsorship is not available for this position.

In compliance with applicable law, all persons hired will be required to verify identity and eligibility to work and to complete employment eligibility verification. Note: Our stewardship of the data of thousands of customers’ means that a criminal background check is required to join New Relic.

We will consider qualified applicants with arrest and conviction records based on individual circumstances and in accordance with applicable law including, but not limited to, the San Francisco Fair Chance Ordinance.

Headhunters and recruitment agencies may not submit resumes/CVs through this website or directly to managers. New Relic does not accept unsolicited headhunter and agency resumes, and will not pay fees to any third-party agency or company that does not have a signed agreement with New Relic.

New Relic is proud to be an equal opportunity employer. We foster a diverse, equitable, and inclusive environment, free from all types of discrimination, so our Relics can thrive. We hire people with different backgrounds, experiences, abilities and perspectives.

Candidates are evaluated based on qualifications, regardless of race, religion, ethnicity, national origin, sex, sexual orientation, gender expression or identity, age, disability, neurodiversity, veteran or marital status, political viewpoint, or other legally protected characteristics.

Review our Applicant Privacy Notice at https://newrelic.com/termsandconditions/applicant-privacy-policy.

Estimated Base Pay Range: $ 174,000 - $ 218,000

The pay range above represents a reasonable estimate of the salary for the listed position. This role is eligible for a corporate bonus plan. Pay within this range varies by work location and may also depend on job-related factors such as an applicant’s skills, qualifications, and experience.

New Relic provides a variety of benefits for this role, including healthcare, dental, vision, parental leave and planning, mental health benefits, a 401(k) plan and match, flex time-off, 11 paid holidays, volunteer time off, and other competitive benefits designed to improve the lives of our employees.",218000.0,YEARLY,"Cleveland, OH",426253.0,4.0,,174000.0,Full-time,,1713502247000.0,1.0,https://www.linkedin.com/jobs/view/3905394682/?trk=jobs_biz_prem_srch,https://newrelic.careers/en_US/careers/JobDetail/Lead-Software-Development-Engineer-Developer-Platform-Team-Golang-Remote/4337?s=LinkedIn&nl=0,OffsiteApply,1716095369000.0,,Mid-Senior level,,1713503369000.0,newrelic.careers,0,FULL_TIME,USD,BASE_SALARY,196000.0,44102.0,39035.0
