industry_id,industry_name,job_id,company_name,title,description,max_salary,pay_period,location,company_id,views,med_salary,min_salary,formatted_work_type,applies,original_listed_time,remote_allowed,job_posting_url,application_url,application_type,expiry,closed_time,formatted_experience_level,skills_desc,listed_time,posting_domain,sponsored,work_type,currency,compensation_type,normalized_salary,zip_code,fips
96,IT Services and IT Consulting,3900964110,Oracle,Principal Technical Program Manager,"Job Description

At Oracle Cloud Infrastructure (OCI), we build the future of the cloud for Enterprises. We act with the speed and attitude of a start-up along with the scale and customer-focus of the leading enterprise software company in the world.

As we continue to grow, we are looking for experienced and highly motivated Technical Program Managers to inspire change at scale across our Infrastructure Delivery Engineering team. The ideal candidate can manage fast paced change enabled by technology while using their proven program and project management capabilities.

If you are ready to drive consistently great customer outcomes and accelerate the growth of our business, come join the Oracle Cloud Infrastructure (OCI) organization.

With the ongoing expansion of our business, we need a strong Principal Technical Program Manager for the OCI Infrastructure Delivery Engineering team. This is a high impact role that will lead, oversee, and ensure the successful delivery and management of critical initiatives on our strategic roadmap. The role comes with a high degree of personal accountability and autonomy and will require effective engagement across multiple OCI teams.

The successful candidate will demonstrate the ability to own the planning, design, and execution of processes with the product team and engineering. They will drive decision-making, roadmaps, and initiative implementation to achieve measurable impact for the organization.

Ideal Experience

8+ years of program/project management experienceBackground in technology enabled change ideally within a cloud infrastructure datacenter environmentProven ability to create effective relationships, listen, influence, and collaborate at all organizational levelsAbility to inspire confidence in senior leaders and motivate distributed team membersLeading and managing a can-do attitude through continual change, ambiguity; able to identify systemic approaches to solving problemsExcellent communication skills including high quality written communications and the ability to articulate complex information in a simple wayOutstanding cross-group collaboration skills and proven ability to partner across teamsProactive, forward-thinking, yet pragmatic and technically savvy, with the ability to synthesize disparate information effectively and quickly into clear recommendations, actions, and decisionsProgram/project management certifications or qualifications with proven ability to deliver complex programsDemonstrated ability to think from a business/outcome perspective and translate that into executable delivery and clear accountabilitiesA career learner – proof that you’re always looking for “better” and can absorb and apply new skills quickly.
Career Level - IC4

Responsibilities

End-to-end leader in charge of the program, from shaping the approach to achieving the desired outcomes through delivery. Influence, activate, and orchestrate across teams to build alignment and get resultsProvide program and project management expertise to complex business initiatives that are global in nature, understanding inter-dependencies between process, technology, and people needsIdentify and schedule project deliverables, milestones, and ensure that project goals are in line with customer and business objectives Influence, activate, and orchestrate across teams to build alignment and drive results, managing feedback/problems from our customers and partnersDrive and achieve successful change management through industry recognized approachesBuild relationships and collaborate globally with team members and partners to deliver outcomes across the organization, ensuring a shared understanding of progress and performanceEnsure that stated and unstated goals, business issues, concerns and priorities are surfaced and understoodSeek opportunities to bring about ongoing improvement and simplification in business operating procedures and practices leading to improved efficiency and effectivenessTrack and manage priorities and committed actions to drive progress and provide actionable insights.


Qualifications

Disclaimer:

Certain US customer or client-facing roles may be required to comply with applicable requirements, such as immunization and occupational health mandates.

Range and benefit information provided in this posting are specific to the stated locations only

US: Hiring Range: from $87,800 - $199,500 per year. May be eligible for bonus and equity.

Oracle maintains broad salary ranges for its roles in order to account for variations in knowledge, skills, experience, market conditions and locations, as well as reflect Oracle’s differing products, industries and lines of business.

Candidates are typically placed into the range based on the preceding factors as well as internal peer equity.

Oracle US offers a comprehensive benefits package which includes the following:

 Medical, dental, and vision insurance, including expert medical opinion Short term disability and long term disability Life insurance and AD&D Supplemental life insurance (Employee/Spouse/Child) Health care and dependent care Flexible Spending Accounts Pre-tax commuter and parking benefits 401(k) Savings and Investment Plan with company match Paid time off: Flexible Vacation is provided to all eligible employees assigned to a salaried (non-overtime eligible) position. Accrued Vacation is provided to all other employees eligible for vacation benefits. For employees working at least 35 hours per week, the vacation accrual rate is 13 days annually for the first three years of employment and 18 days annually for subsequent years of employment. Vacation accrual is prorated for employees working between 20 and 34 hours per week. Employees working fewer than 20 hours per week are not eligible for vacation. 11 paid holidays Paid sick leave: 72 hours of paid sick leave upon date of hire. Refreshes each calendar year. Unused balance will carry over each year up to a maximum cap of 112 hours. Paid parental leave Adoption assistance Employee Stock Purchase Plan Financial planning and group legal Voluntary benefits including auto, homeowner and pet insurance


About Us

As a world leader in cloud solutions, Oracle uses tomorrow’s technology to tackle today’s problems. True innovation starts with diverse perspectives and various abilities and backgrounds.

When everyone’s voice is heard, we’re inspired to go beyond what’s been done before. It’s why we’re committed to expanding our inclusive workforce that promotes diverse insights and perspectives.

We’ve partnered with industry-leaders in almost every sector—and continue to thrive after 40+ years of change by operating with integrity.

Oracle careers open the door to global opportunities where work-life balance flourishes. We offer a highly competitive suite of employee benefits designed on the principles of parity and consistency. We put our people first with flexible medical, life insurance and retirement options. We also encourage employees to give back to their communities through our volunteer programs.

We’re committed to including people with disabilities at all stages of the employment process. If you require accessibility assistance or accommodation for a disability at any point, let us know by calling +1 888 404 2494, option one.

Disclaimer:

Oracle is an Equal Employment Opportunity Employer*. All qualified applicants will receive consideration for employment without regard to race, color, religion, sex, national origin, sexual orientation, gender identity, disability and protected veterans’ status, or any other characteristic protected by law. Oracle will consider for employment qualified applicants with arrest and conviction records pursuant to applicable law.

 Which includes being a United States Affirmative Action Employer",,,"Seattle, WA",1028.0,7.0,,,Full-time,,1713312000000.0,,https://www.linkedin.com/jobs/view/3900964110/?trk=jobs_biz_prem_srch,https://eeho.fa.us2.oraclecloud.com/hcmUI/CandidateExperience/en/job/237489/?utm_medium=jobboard&utm_source=LinkedIn,OffsiteApply,1715985155000.0,,Mid-Senior level,,1713393155000.0,eeho.fa.us2.oraclecloud.com,0,FULL_TIME,,,,98101.0,53033.0
96,IT Services and IT Consulting,3904361252,Leidos,CRM Business System Analyst,"Description

Looking for an opportunity to make an impact?

At Leidos, we deliver innovative solutions through the efforts of our diverse and talented people who are dedicated to our customers’ success. We empower our teams, contribute to our communities, and operate sustainably. Everything we do is built on a commitment to do the right thing for our customers, our people, and our community. Our Mission, Vision, and Values guide the way we do business.

If this sounds like the kind of environment where you can thrive, keep reading!

Leidos seeks a CRM Business Systems Analyst to support the Digital Solution, Inc. program. The selected candidate will have the ability to assist customers with Customer Relationship Management (CRM) technical support issues as well as consulting with customers on their business processes and the relevant CRM software usage to meet those business process requirements. Onsite/In-office software consulting and software support with occasional remote customer support in a demanding Capitol Hill environment. The ability to communicate effectively with VIP customers is a plus.

Please Note: Must be able to work onsite as needed in Washington, DC, up to 5 days a week some weeks, with some potential for some remote work. This is subject to change based on Leidos, customer, and local government policy related to Pandemic Remote Work.

The Challenge

Provide consultation to help customers develop and modify system configurations for leveraging Customer Relationship Management (CRM) information systems (IQ) to achieve mission outcomes.Guide customers in formulating new sound business and related technical processes as well as analyzing/optimizing current processes.Coordination with customer business process owners and various technology teams to ascertain/develop technical requirements and user acceptance testing relating to CRM system functions including but not limited to new data acquisition and system VIP output.Ability to multi-task while supporting VIP clients.Provide daily support for Intranet Quorum (IQ) product to customers.Provide weekly reports and open tickets for each support or consulting request from customers.Train Intranet Quorum (IQ) product to new customers as they turnover in customer offices.

What Sets You Apart

Bachelor’s degree in related field with two or less (2-) years of relevant experience , may consider more years of experience in lieu of degree.Ability to learn proprietary CRM software.Basic knowledge of HTML and troubleshooting skills.Ability to clearly/concisely/effectively communicate in writing or in verbal exchange with varying audiences.Ability to effectively synthesize clear explanations of complex technical or business process to audiences with varying levels of background and expertise.Two plus (2+) years of relevant experience with MS Office productsThis position requires U.S Citizenship and be able to obtain and maintain Public Trust Security Clearance

You Might Also Have

Familiarity with CRM software similar to Salesforce or Microsoft Dynamics and associated business process.Advanced knowledge with MS ExcelFamiliarity with XML tags and parameter filesMicrosoft server 2016/2019 knowledge and experienceExperience with Oracle/SQLOne (1+) years of experience working in a Senator or Congressman’s office using IQ (Intranet Quorum)Experience with Technical Support ticket tracking

We take care of our employees. Leidos seeks the best and the brightest, and in return, we invest in you, with an eye on your future, through career advancement, growth opportunities and continuous improvement via mentoring, formal and informal project management training and assistance with obtaining pertinent certifications. We challenge you to help solve some of the world’s toughest problems, and reward you with a welcoming culture that recognizes the importance of a strong work/life balance, as well as competitive compensation and benefits. We believe that diversity and inclusion make us all better and offer the chance to have fun and make a difference.

Original Posting Date

2024-04-17

While subject to change based on business needs, Leidos reasonably anticipates that this job requisition will remain open for at least 3 days with an anticipated close date of no earlier than 3 days after the original posting date as listed above.

Pay Range

Pay Range $48,100.00 - $86,950.00

The Leidos pay range for this job level is a general guideline only and not a guarantee of compensation or salary. Additional factors considered in extending an offer include (but are not limited to) responsibilities of the job, education, experience, knowledge, skills, and abilities, as well as internal equity, alignment with market data, applicable bargaining agreement (if any), or other law.",,,"Washington, DC",2973906.0,6.0,,,Full-time,,1713388395000.0,,https://www.linkedin.com/jobs/view/3904361252/?trk=jobs_biz_prem_srch,https://careers.leidos.com/jobs/14259151-crm-business-system-analyst?tm_job=R-00133322&tm_event=view&tm_company=2502&bid=370,OffsiteApply,1715981279000.0,,Mid-Senior level,,1713389279000.0,careers.leidos.com,0,FULL_TIME,,,,20001.0,11001.0
96,IT Services and IT Consulting,3898178037,EA Team Inc,Training Coordinator,"Job Title: Training Coordinator Job Type: 06+ Months ContractLocation: San Francisco, CA 94105Shift: Mon & Fri 

Job DescriptionWhat is the scope of work for this vendor worker during this period?Coordination and production of virtual and in-person workshops and their setup (including facilitator coordination, communications to learners, and logistics management for all sessions)Manage the technology and enrollment process of our programs - partnering with our tech team to troubleshoot issues that arise, and utilize a bug ticket system to help with intake of user feedback. Position Overview:The Mastery Team is a global function focused on scaled education of Google’s Global Business Organization (GBO) teams, as well as their customers and partners. We aspire to be global leaders in adult learning and to shape the future of the educational model worldwide. We bundle a dash of creativity with a dose of analytical rigor, instructional knowledge, and technical product expertise to build innovative educational solutions that optimize the learning experience. Our passion for learning, relentless focus on global impact (internally & externally), and need to have fun is what makes our team feel different and special.We are looking for someone bright, creative, and dependable. Someone who’s excited about driving learning programs at scale, can manage a variety of different projects at once, and work from a playbook. As an Experiences Training Coordinator, you're at the heart of the team's training operations and activation. You’ll lead end to end processes and logistics for our live programs, including managing the technology, enrollment and user feedback processes.Skill/Experience/Education (Mandatory)BA/BS degree or equivalent practical experience.3-5 years of training coordination or event management experience (producing or planning events).Outstanding attention to detail and operational rigor to drive processAbility to own multiple projects or programs from end to endAbility to prioritize and complete multiple tasksHighly organized and detailed-orientedExcellent communication skillsA resourceful problem solver with little to no oversight neededExcellent knowledge of Google Apps (esp. Gmail, Google Calendar, Google Sheets, Google Slides, Google Docs)Ability to quickly learn new tools and technologies; interest and experience in using technology and learning management systems to improve work efficiencyPreferred Experience:(Having as many of these is a plus, but transferable skills / experiences may be equally valuable)Experience with a learning management systemAbility to assess problems and implement solutions independentlyHighly motivated professional with demonstrated coordination, organizational and communication skills.Responsibilities:Administration/Logistics management:Setting up training sessions in our learning management system and managing enrollments end to end on a daily basis.Creating and scheduling large volumes of bulk email campaigns to keep our learners reminded and updated about session information and any required pre-work.Producing live workshop sessions - supporting our facilitators in the moment by creating breakout rooms, marking attendance, fixing tech issues, messaging with our learners in the background, supporting the general flow of the session.Coordinates and manages multiple cohorts simultaneously to ensure a continuous, consistent and uninterrupted learning experienceSupporting program managers on planning for and executing in-person sessions where applicable. This will include, for example, ordering and printing materials, setting up meeting rooms, organizing catering and offsite activities.Dealing with email requests from learners in relation to enrollments, cancellations etc.Writing and sending via comms system monthly newsletters to facilitators.Support in recruiting, upskilling and retaining the facilitator community by partnering with the teams in need and creating specific comms.Assigning facilitators to their programs, scheduling their sessions and sending rosters.Troubleshoot issues that arise, and utilize a bug ticket systemReportingPull data to support capacity and activation planningTrack training goal completion and gather useful insights to drive engagementUse analytical skills to conduct post-event reporting and ROI analysis to measure program effectiveness.Uncover fresh audience insights and define creative and strategic approaches to solving our biggest event challengesShare survey insights with external partners or faculty where needed
",,,"San Francisco, CA",2314143.0,64.0,,,Contract,7.0,1713214583000.0,,https://www.linkedin.com/jobs/view/3898178037/?trk=jobs_biz_prem_srch,,SimpleOnsiteApply,1715806583000.0,,,,1713214583000.0,,0,CONTRACT,,,,94101.0,6075.0
96,IT Services and IT Consulting,3906234559,MSX International,Part Time Event Worker,"Title: Part-Time Event Worker

Location: Different Events Across the US

Job Type: Casual/Temporary/Support for Project Based Events

Schedule: Temporary on-call up to 30 hours per week; weekly schedule will require working events on weekends and traveling evenings and weekends.

 

Who We Are: 

For more than 25 years, MSX International has been a dedicated partner to leading automotive brands around the world. We support them in transforming their businesses and in managing their operations across the areas of Customer Experience, Repair Optimization, Learning and Insights. We focus on helping our clients generate more value for their customers. With over 5,000 employees based in more than 80 countries worldwide, our teams provide industry-leading expertise. We have combined our deep industry expertise with cutting-edge technology solutions to help our automotive clients increase revenue and reduce costs, while enhancing operational efficiency and improving customer satisfaction.  Our goal is to help our customers reach their full potential and to excel as their global partner of choice.

The Role:

As part of the Event Management team, you will represent MSX and support the client’s onsite automotive clinics; the clinics will be held in multiple cities across the United States and the goal is to provide software updates as well as distribute anti-theft devices to their customer base.

What You Will Be Doing:

This position involves collecting, reviewing, and inputting accurate data into a customized software system and directly interacting with the client’s customers.

Responsibilities include but are not limited to:  

Complete tasks accurately and timely in order to meet client service level expectations.Accurately input event data into client vehicle management system and identify and accurately communicate recommendations to client’s customers.Willing and able to travel Wednesday and/or Thursday for a weekend event and fly home after the event Sunday and or Monday Morning.Schedule is based on client requirements and will be on an on-call as needed basis. Working before and after regular business hours, and weekend hours are required to support client initiatives.Positions will be rotated as needed amongst the team throughout the events.Must be able to drive multiple makes and models of non-commercial vehicles in a valet capacity.Must be able to assist customers and provide traffic control to ensure pedestrian safety.Must have the ability to think and act quickly to ensure traffic is moving safely and efficiently.May be responsible for other duties related to supporting the events as assigned by, but not limited to, the client requirements and the event management team.

Requirements of the Role:

Applicants must be authorized to work for any employer in the U.S. We are unable to sponsor or take over sponsorship of an employment Visa at this time. 

Must be at least 21 years old and have a clean, valid driving record.Must have the ability to accommodate a flexible work schedule which includes traveling after hours and working 10-hour shifts on Fridays, Saturdays, and Sundays.Travel expenses including flights and hotels will be booked & paid for according to policy by MSX. Working before and after regular business hours, and weekend hours are required to support client initiatives.Overall awareness and understanding of customer satisfaction and previous experience working in the service industry is important.Must be computer literate and have excellent data entry skills.Excellent written and verbal communication skills, good organizational skills, and strong attention to detail needed.Ability to successfully manage multiple priorities.Ability to fluently speak English and Spanish is a plus.Must be computer literate and have excellent data entry skills.A certain degree of creativity, latitude, and problem solving is required.H. S. diploma or equivalent required; bachelor’s degree in progress or completed is preferred. Previous experience in the automotive industry is a plus.

Skills & Competencies:

Rock Solid Reliability – I earn the trust of clients, co-workers by delivering what is promised; I deliver high quality work on time and on task; I take the time to do things right.Solution Driven – I creatively find solutions to problems clients are experiencing by collaborating with management and treating customers with respect.Winning Teamwork – I collaborate with others; I share information openly; I listen and take time to empathize and understand where others are coming from; I show recognition and appreciation for the contributions of others.


Apply Now!

#MSXNAJobs 

MSXi is committed to employing a diverse workforce. Qualified applicants will receive consideration without regard to race, color, religion, sex, national origin, age, sexual orientation, gender identity, veteran status, or disability. ",,,"Michigan, United States",165062.0,2.0,,,Part-time,,1713563544000.0,,https://www.linkedin.com/jobs/view/3906234559/?trk=jobs_biz_prem_srch,https://careers.msxi.com/job/Part-Time-Event-Worker-MI/1157742300/?utm_source=linkedin,OffsiteApply,1716156293000.0,,Mid-Senior level,,1713564293000.0,careers.msxi.com,0,PART_TIME,,,,,
