industry_id,industry_name,job_id,company_name,title,description,max_salary,pay_period,location,company_id,views,med_salary,min_salary,formatted_work_type,applies,original_listed_time,remote_allowed,job_posting_url,application_url,application_type,expiry,closed_time,formatted_experience_level,skills_desc,listed_time,posting_domain,sponsored,work_type,currency,compensation_type,normalized_salary,zip_code,fips
1285,Internet Marketplace Platforms,3887496947,Vivian Health,Registered Nurse (RN) - ED - Emergency Department - $32-58 per hour - 115814,"Atrium Health is seeking a Registered Nurse (RN) ED - Emergency Department for a nursing job in Charlotte, North Carolina.

Job Description & Requirements

Specialty: ED - Emergency DepartmentDiscipline: RNDuration: Ongoing36 hours per weekShift: 12 hours, eveningsEmployment Type: Staff

Overview

This position is Sign-on Bonus eligible. Experienced RNs are eligible for a bonus for FT teammates and PT teammates based on experience. In addition to the sign-on bonus, new teammates at Atrium Health are eligible for robust benefits packages, paid time off, and a Career Advancement Ladder.

For more than 100 years, Atrium Health Mercy has treated approximately 80-110 ED and 130-212 in-patients daily with a special combination of human compassion and leading-edge expertise. Atrium Health Mercy is a full-service community hospital, specializing in the care of seniors and in complex foot and ankle surgery, hip and knee surgery, bariatric surgery, and women’s pelvic health. Atrium Health Mercy is Magnet certified in Nursing Excellence and is also a Planetree certified, patient-centered hospital. The Planetree model is committed to enhancing health care from the patient's perspective; empowers patients and families by providing information and education, cultivates healing of the mind-body-spirit, provides patient-directed care, is value-based, holistic and promotes safety of patients through active involvement in their own care.

As a Planetree Certified facility, we focus on the following:

Connect values, strategies, and actionImplement practices that promote partnershipUse evidence to drive improvementCreate organizational structures that promote engagement

Job Summary

The RN Clinical Nurse I provides professional nursing care through skillful assessment, diagnosis, outcomes identification, planning, implementation, and evaluation in accordance with facility or department policies procedures, and/or protocols under the supervision of the nursing leader. Assists in maintaining a safe work environment and performs all related job responsibilities in a safe manner. Maintains clinical and professional competency as appropriate to the population of patients served.

Essential Functions

Collects data pertinent to the healthcare consumer's health or the situation. Analyzes the assessment data to determine actual or potential diagnoses, problems, and issues. Identifies expected outcomes for a plan individualized to the healthcare consumer or the situation. Develops a plan that prescribes strategies to attain expected, measurable outcomes. Implements the identified plan, coordinates care delivery, and employs strategies to promote health and a safe environment. Delegates elements of care to appropriate healthcare workers in accordance with any applicable legal or policy parameters or principles. Evaluates progress toward attainment of goals and outcomes. Practices in a manner that is congruent with cultural diversity and inclusion principles. Communicates effectively in all areas of practice. Collaborates with healthcare consumer and other key stakeholders in the conduct of nursing practice. Leads within the professional practice setting and the profession. Integrates evidence and research findings into practice. Contributes to quality nursing practice. Evaluates one's own and others nursing practice in relation to professional practice standards and guidelines, relevant statutes, rules and regulations. Utilizes appropriate resources to plan, provide, and sustain evidence-based nursing services that are safe, effective, and fiscally responsible. Practices in an environmentally safe and healthy manner. Practices ethically. Promotes shared governance, or facility decision making activities, developing and nurturing research to positively affect clinical outcomes and promotion. 

Physical Requirements

Work requires walking, standing, sitting, lifting, reaching, stooping, bending, pushing, and pulling. Must be able to lift and support the weight of 35 pounds in handling patients, medical equipment, and supplies. Must speak English in good, understandable terms. Intact sense of sight, hearing, smell, and touch. Finger dexterity. Critical thinking and ability to concentrate. Must be able to respond quickly to changes in patient and/or unit conditions. Physical Abilities Testing required.

Education, Experience And Certifications.

Graduate from an accredited School of Nursing. BSN preferred. Current Basic Life Support required per policy guidelines. Current RN license or temporary license as a Registered Nurse Petitioner in the state in which you work and reside or; if declaring a National License Compact (NLC) state as your primary state of residency, meet the licensure requirements in your home state; or for Non-National License Compact states, current RN license or temporary license as a Registered Nurse Petitioner required in the state where the RN works.

Atrium Health Job ID #115814. Posted job title: registered nurse - atrium health mercy emergency department ft midshift (11a-11p)

About Atrium Health

Headquartered in Charlotte, NC, Atrium Health is now part of Advocate Health , the third-largest nonprofit, integrated health system in the United States, which was created from the combination with Advocate Aurora Health. In the Southeast Region, Atrium Health provides care under the Atrium Health name in Charlotte, NC, Atrium Health Wake Forest Baptist name in the Winston-Salem, NC, region, as well as Atrium Health Navicent and Atrium Health Floyd in Georgia and Alabama. Together, we are committed to providing equitable care for all. Annually, Advocate Health provides nearly $5 billion in community benefits.

Atrium Health Wake Forest Baptist

Atrium Health Wake Forest Baptist is a pre-eminent academic health system based in Winston-Salem, North Carolina. Atrium Health Wake Forest Baptist is part of Advocate Health, which is headquartered in Charlotte, North Carolina, and is the fifth-largest nonprofit health system in the United States, created from the combination of Atrium Health and Advocate Aurora Health. Atrium Health Wake Forest Baptist's two main components are an integrated clinical system - anchored by Atrium Health Wake Forest Baptist Medical Center, an 885-bed tertiary-care hospital in Winston-Salem - that includes Brenner Children's Hospital, five community hospitals, more than 300 primary and specialty care locations and more than 2,700 physicians; and Wake Forest School of Medicine, the academic core of Atrium Health Enterprise and a recognized leader in experiential medical education and groundbreaking research that includes Wake Forest Innovations, a commercialization enterprise focused on advancing health care through new medical technologies and biomedical discovery.

Atrium Health Navicent

Atrium Health Navicent is the leading provider of healthcare in central and south Georgia and is committed to its mission of elevating health and well-being through compassionate care. Atrium Health Navicent is part of Advocate Health, which is headquartered in Charlotte, North Carolina, and is the third-largest nonprofit health system in the United States, created from the combination of Atrium Health and Advocate Aurora Health. Atrium Health Navicent provides high-quality, personalized care in 53 specialties at more than 50 facilities throughout the region. As part of the largest, integrated, nonprofit health system in the Southeast, it is also able to tap into some of the nation's leading medical experts and specialists with Atrium Health, allowing it to provide the best care close to home - including advanced innovations in virtual medicine and care. Throughout its 125-year history in the community, Atrium Health Navicent has remained dedicated to enhancing health and wellness for individuals throughout the region through nationally recognized quality care, community health initiatives and collaborative partnerships. It is also one of the leading teaching hospitals in the region, helping to ensure viability for rural health care for the next generation.

Atrium Health Floyd

Atrium Health Floyd Medical Center is a 304-bed, full-service hospital located in Rome, Georgia. Serving as the main campus for Atrium Health Floyd, this hospital provides a certified Chest Pain Center, a designated Bariatric Surgery Center of Excellence and a Breast Imaging Center of Excellence. Atrium Health Floyd also is home to a state-designated Level II Trauma Center and a Level III Neonatal Intensive Care Unit, and has specialty centers for pediatrics, and wound care and hyperbaric therapy.

Benefits

Medical benefitsVision benefitsDental benefitsLife insurance401k retirement planHealth savings account

",,,"Charlotte, NC",18506580.0,7.0,,,Full-time,,1712275200000.0,,https://www.linkedin.com/jobs/view/3887496947/?trk=jobs_biz_prem_srch,https://click.appcast.io/track/j3kwq9v?cs=i2e&sjg=6xbh,OffsiteApply,1714941339000.0,,,,1712349339000.0,click.appcast.io,0,FULL_TIME,,,,28202.0,37119.0
1285,Internet Marketplace Platforms,3895530226,Vivian Health,Registered Nurse (RN) - Pediatrics - $32-58 per hour - 116250,"Atrium Health is seeking a Registered Nurse (RN) Pediatrics for a nursing job in Charlotte, North Carolina.

Job Description & Requirements

Specialty: PediatricsDiscipline: RNDuration: Ongoing39 hours per weekShift: 12 hoursEmployment Type: Staff

Overview

Job Summary

Directs and leads all aspects of clinical, regulatory, business, and other research- related activities and documentation for clinical trials on behalf of the Levine Cancer Institute, following industry standards and applicable regulations including FDA/OHRP guidance, GCP and ICH.

Essential Functions

Competently fulfills the job responsibilities of the Oncology Research Consultant, and:Coordinates the clinical care of patients being evaluated for and/or patients already participating in the trial program, including research activities, and education as appropriate. Coordinates clinical care throughout the program utilizing pathways, and developing tools to ensure high quality, cost effective continuity of care. Ensuring compliance with federal and institutional research regulations. Ensures a master file of protocols with requisite regulatory requirements, data forms, source documentation and patient files is maintained. Coordinates research site selection, monitor, audit, QA and regulatory visits. Educates patients and families about research studies, treatments, side effects and follow-up, as appropriate. Supervises and coordinates assigned programs across clinics/sites. Coordinates, follows, and evaluates patient participation in clinical trials to ensure compliance with the protocol. Provides accrual and other metrics to leadership. Performs protocol specific tasks including patient assessment, eligibility screening, specimen collection, toxicity assessment, and monitoring of responses. Manages protocol and program quality assurance activities, monitoring visits, and audits. Works with research team to ensure that regulatory findings and data queries are resolved. Collaborates with principal investigator(s) to assist in developing plans for research projects and to discuss the interpretation of results; collaborates on the preparation of manuscripts for publication. Coordinates the regulatory coordination in preparing and submitting accurate study materials, interim reports, annual reports, amendments and case records to sponsors and the IRB as required within the designated time period. 

Physical Requirements

Primarily works in an office setting. Requires full range of body motion; sitting for extensive periods of time; walking, standing, reading, and writing/keyboarding. Occasionally lifts and carries items weighing up to 35 pounds. Requires corrected vision and hearing within normal range. Must speak and read/write clearly in English. Must be able to be mobile within the entire healthcare system and other locations that participate in LCI clinical trials.

Education, Experience And Certifications

Must hold a valid North Carolina or South Carolina (as applicable) Board of Nursing license. Bachelor’s Degree and 5 or more years of clinical research experience with a pharmaceutical company or Contract Research Organization or equivalent experience required; or Master’s Degree and 4 or more years of clinical research experience with a pharmaceutical company or Contract Research Organization or equivalent experience required; or a minimum of 9 years clinical research experience with a pharmaceutical company or Contract Research Organization or equivalent experience required with no degree. Bachelor’s Degree in Nursing or Master’s Degree in Nursing or other health/science degree concentration preferred. CPR certification required. Previous experience in a healthcare setting required, especially in a cancer care and/or cancer research environment. Certification in clinical research (SoCRA, ACRP, RAPS, etc.) required. Certification in oncology nursing specialty preferred (OCN®, CPHON®, AOCNP®, AOCNS®, CBCN®, etc.). Supervisory experience or experience leading teams required.

Atrium Health feeds Job ID #6301-116250. Posted job title: Registered Nurse Senior Oncology Research Consultant- Atrium Health Levine Children's Consortium Charlotte FT

About Atrium Health

Headquartered in Charlotte, NC, Atrium Health is now part of Advocate Health , the third-largest nonprofit, integrated health system in the United States, which was created from the combination with Advocate Aurora Health. In the Southeast Region, Atrium Health provides care under the Atrium Health name in Charlotte, NC, Atrium Health Wake Forest Baptist name in the Winston-Salem, NC, region, as well as Atrium Health Navicent and Atrium Health Floyd in Georgia and Alabama. Together, we are committed to providing equitable care for all. Annually, Advocate Health provides nearly $5 billion in community benefits.

Atrium Health Wake Forest Baptist

Atrium Health Wake Forest Baptist is a pre-eminent academic health system based in Winston-Salem, North Carolina. Atrium Health Wake Forest Baptist is part of Advocate Health, which is headquartered in Charlotte, North Carolina, and is the fifth-largest nonprofit health system in the United States, created from the combination of Atrium Health and Advocate Aurora Health. Atrium Health Wake Forest Baptist's two main components are an integrated clinical system - anchored by Atrium Health Wake Forest Baptist Medical Center, an 885-bed tertiary-care hospital in Winston-Salem - that includes Brenner Children's Hospital, five community hospitals, more than 300 primary and specialty care locations and more than 2,700 physicians; and Wake Forest School of Medicine, the academic core of Atrium Health Enterprise and a recognized leader in experiential medical education and groundbreaking research that includes Wake Forest Innovations, a commercialization enterprise focused on advancing health care through new medical technologies and biomedical discovery.

Atrium Health Navicent

Atrium Health Navicent is the leading provider of healthcare in central and south Georgia and is committed to its mission of elevating health and well-being through compassionate care. Atrium Health Navicent is part of Advocate Health, which is headquartered in Charlotte, North Carolina, and is the third-largest nonprofit health system in the United States, created from the combination of Atrium Health and Advocate Aurora Health. Atrium Health Navicent provides high-quality, personalized care in 53 specialties at more than 50 facilities throughout the region. As part of the largest, integrated, nonprofit health system in the Southeast, it is also able to tap into some of the nation's leading medical experts and specialists with Atrium Health, allowing it to provide the best care close to home - including advanced innovations in virtual medicine and care. Throughout its 125-year history in the community, Atrium Health Navicent has remained dedicated to enhancing health and wellness for individuals throughout the region through nationally recognized quality care, community health initiatives and collaborative partnerships. It is also one of the leading teaching hospitals in the region, helping to ensure viability for rural health care for the next generation.

Atrium Health Floyd

Atrium Health Floyd Medical Center is a 304-bed, full-service hospital located in Rome, Georgia. Serving as the main campus for Atrium Health Floyd, this hospital provides a certified Chest Pain Center, a designated Bariatric Surgery Center of Excellence and a Breast Imaging Center of Excellence. Atrium Health Floyd also is home to a state-designated Level II Trauma Center and a Level III Neonatal Intensive Care Unit, and has specialty centers for pediatrics, and wound care and hyperbaric therapy.

Benefits

Medical benefitsVision benefitsDental benefitsLife insurance401k retirement planHealth savings account

",,,"Charlotte, NC",18506580.0,5.0,,,Full-time,,1712793600000.0,,https://www.linkedin.com/jobs/view/3895530226/?trk=jobs_biz_prem_srch,https://click.appcast.io/track/j5ke2ce?cs=i2e&sjg=6xbh,OffsiteApply,1715481392000.0,,Mid-Senior level,,1712889392000.0,click.appcast.io,0,FULL_TIME,,,,28202.0,37119.0
1285,Internet Marketplace Platforms,3905349625,Uber,"Program Leader, Earner digital experiences","About The Role

The Earner Channels Senior Program Manager sits within our Global Digital Experience team, the digital service design arm of the global CommOps organization. This role will work with various teams in CommOps and Tech to craft the ways our earners access customer support across Mobility and Delivery services, globally. This involves understanding the Earner journey, from sign-up through trip or order, on the Uber platform end to end, as well as channel preferences in different geographies. As a program manager, you will take an active role in the formation of the channel strategy and lead work streams/programs thus seeing it through to the finish line. If this role sounds exciting to you, please apply today !

What You'll Do

 Own the global Earner channel strategy for both the delivery & mobility businesses  Align regional businesses to the global strategy and roll out the strategy across all regions in a global-first manner  Build an in-depth understanding of the earner experience, including the most efficient and effective means for earners to get help with pre-trip, on-trip, and post-trip issues  Run analysis and develop strategic insights on both quantitative and qualitative data about earner experience to influence the future of support  Collaborate within the team and other outstanding teams across regions to consolidate different viewpoints, clarify problem statements, identify strategy, and drive high-impact solutions  Deliver and maintain CO channel products to meet earner needs  Lead alignment with other functional teams, globally, to implement short-term solutions in a timely manner while elaborating on the long-term, evolving strategy  Develop a point of view regarding the trade offs between cost and experience for different channel choices  Ensure that quality CO earner channel products are launched on time and with features which deliver the business objectives, communicate product value to the regions, and be held accountable for adoption 

 Basic Qualifications 

 Bachelor's degree Acquired  5+ years overall experience working in Program Management, consulting and or within a similar field  Strong problem solving, analytical and critical thinking skills 

 Preferred Qualifications 

 MBA from a top-tier Business school (or equivalent)  7+ years overall working in a similar or relevant position focused on the customer experience  Significant experience developing and implementing channel strategy in-market is a plus  Experience in a top-tier strategy consulting firm  Strong operational background and a track record of making data driven decisions  Familiarity with emerging channel technologies, especially as it relates to customer service  Exceptionally strong stakeholder management skills and ability to handle pushbacks  Advanced Excel/data management skills  Obsession for delivering great customer experience 

 About the Team 

Community Operations is pioneering how Uber manages rider and driver partner support around the globe. We are the voice of the customer, and we help unite our safety, risk, payments and identity support programs globally

For Chicago, IL-based roles: The base salary range for this role is USD$137,000 per year - USD$152,000 per year. For New York, NY-based roles: The base salary range for this role is USD$152,000 per year - USD$168,500 per year. For San Francisco, CA-based roles: The base salary range for this role is USD$152,000 per year - USD$168,500 per year. For all US locations, you will be eligible to participate in Uber's bonus program, and may be offered an equity award & other types of comp. You will also be eligible for various benefits. More details can be found at the following link https://www.uber.com/careers/benefits.",168500.0,YEARLY,"Chicago, IL",1815218.0,4.0,,137000.0,Full-time,,1713488132000.0,,https://www.linkedin.com/jobs/view/3905349625/?trk=jobs_biz_prem_srch,https://tnl2.jometer.com/v2/job?jz=5wqzs1c155f4bd08a94835d5b788215690adeCEALBBQAAADQ,OffsiteApply,1716080808000.0,,Mid-Senior level,,1713488808000.0,tnl2.jometer.com,0,FULL_TIME,USD,BASE_SALARY,152750.0,60601.0,17031.0
1285,Internet Marketplace Platforms,3904409701,Uber,Software Engineer II,"About The Role

The Marketplace Fares Team powers global fares for all of Uber - that's all riders, drivers, eaters, new initiatives and technical consumers. Tens of billions of dollars in gross bookings flow through the systems and experiences within our responsibility. Our scope and critical work spans the entire stack - from platform fare calculation for riders and drivers, to data science prediction of dependable upfront prices, to compelling mobile fare experiences for our customers. Fares is a full stack team with two product-centric tracks (Rider Fares & Driver Fares) and multiple platform-centric tracks (Fares Platform, Intelligence, Experiences, and Solutions). On this team, you'll work closely with product, operations, data science, and engineering teams throughout the company.

As a backend engineer you will make an impact in the real world using exciting and new technology. You will work on a fast-paced solutions oriented marketplace team, looking to build robust and powerful features that power the critical internal configuration platform for Fares @ Uber. Your ability to work closely with other specialists, product managers, and product operations teams will bring the best experiences possible in an exciting environment.

What The Candidate Will Do

As a member of the Marketplace Fares team, you will be doing just that: building out and growing our powerful Fares backend systems to help build features and drive key new product launches at Uber.

You will be responsible for development of our framework infrastructure to improve our ability to customize our fare configurations for every Uber business and market need. You will have a deep understanding of the problems our platform solves for. You will also get to work with many different parts of the company in helping drive projects that impact millions of customers. Participate in periodic on-call rotations and be available for critical issues. 

Basic Qualifications

2+ years of experience developing and shipping code for production systemsBachelor's degree or equivalent experience in Computer Science, Information Systems or a similar fieldStrong coding/debugging abilities with at least one coding language. We work with Go, Java, Python

Preferred Qualifications

Shown experience building highly available distributed systems (at Uber scale) and working across multiple backend servicesAbility to work in a fast paced environmentExperience working on scalable backend services using a microservices architectureHigh bar for quality as shown by code reviews, documentation, unit and integration testingBackground in payments/FinTech engineering

For Seattle, WA-based roles: The base salary range for this role is USD$158,000 per year - USD$175,500 per year. You will be eligible to participate in Uber's bonus program, and may be offered an equity award & other types of comp. You will also be eligible for various benefits. More details can be found at the following link https://www.uber.com/careers/benefits.",,,"Seattle, WA",1815218.0,240.0,,,Full-time,76.0,1713401725000.0,,https://www.linkedin.com/jobs/view/3904409701/?trk=jobs_biz_prem_srch,https://tnl2.jometer.com/v2/job?jz=5wqzse76bce3e802529ad752e8e54f4f8be75CEALBBQAAADQ,OffsiteApply,1715994402000.0,,,,1713402402000.0,tnl2.jometer.com,0,FULL_TIME,,,,98101.0,53033.0
