industry_id,industry_name,job_id,company_name,title,description,max_salary,pay_period,location,company_id,views,med_salary,min_salary,formatted_work_type,applies,original_listed_time,remote_allowed,job_posting_url,application_url,application_type,expiry,closed_time,formatted_experience_level,skills_desc,listed_time,posting_domain,sponsored,work_type,currency,compensation_type,normalized_salary,zip_code,fips
3105,IT System Training and Support,3901694512,Adaptive Solutions Group,Systems Engineer II,"Job Description
Description:As an Engineer 2, you will be responsible for providing technical support to customers via telephone, email, and teams. This engineer position requires strong communication, teamwork, problem solving, analytical / innovative thinking and a customer focused mindset. Your responsibilities will include troubleshooting issues, handling escalations, performing trend analysis, engineering solutions and identifying / implementing process enhancements to reduce / eliminate recurring issues from the environment. You will work independently and as part of a team collaborating with internal teams, customers and vendors supporting endpoint technology including desktop, productivity, and mobility solutions.
Required• Must be committed to incorporating security into all decisions and daily job responsibilities• Strong knowledge and proficiency in providing support of the Windows operating system• Working knowledge of Windows Print, Windows Print Server and thin clients• Experience with Microsoft Office 365 cloud and internal environments• Experience with IT Service Management tools (i.e. ServiceNow, Remedy, SolarWinds, etc.)• Professional communication abilities, both written and verbal• Proven technical writing skills• Ability to work in a fast-paced, high demand and challenging environment• Investigates, diagnoses, and resolves complex issues without known solutions• Creates and publishes documentation of knowledge resulting from investigative and support activities for future occurrences• Leverages own technical expertise, including higher-level engineers, knowledge, and other internal tools to provide the most effective solutions to customerissues• Performs task automation and identifies / implements process improvements• Maintains established service level agreements to manage customer expectations and quality standards• Support a flexible work schedule to support our SLA’s with our customers, and provide occasional after hours and weekend support
Preferred• Bachelor's degree in Computer Science, Computer Information Systems, Management Information Systems or commensurate experience• General understanding of Active Directory (GPO, OU, Groups), Windows Server, and scripting (i.e. command line, PowerShell, etc.) knowledge• General knowledge of Citrix VDA, VDI and published application environments• General understanding of Android OS and Mac OS• Experience with Cisco AnyConnect• Splunk experience a plus• Working knowledge of agile methodology using JIRA• Ability to identify trends and opportunities for improvement using data analytics• Ability to interpret and visualize data results in order to create effective dashboards and reporting
100% remoteCandidates MUST currently live in MO, IL, KS, TN, TX, VA, MI, GA, FL, OK. Not open to relocation.1+ year contract",47.0,HOURLY,United States,35647.0,247.0,,38.0,Contract,66.0,1713215042000.0,1.0,https://www.linkedin.com/jobs/view/3901694512/?trk=jobs_biz_prem_srch,,ComplexOnsiteApply,1715807041000.0,,Mid-Senior level,,1713215042000.0,,0,CONTRACT,USD,BASE_SALARY,88400.0,,
3105,IT System Training and Support,3898170701,Insight Global,Help Desk Technician,"Job DescriptionA large home healthcare company is looking to hire a helpdesk technician to join their application support team. This person will be responsible for answering incoming troubleshooting requests via phone calls, JIRA ticketing system and email. This person will resolve 12-15 tickets a day- issues will range from password rests, resolving MS office issues such as Outlook not responding, as well as supporting/troubleshooting internal EMR applications. In addition they will provide white glove service following up with users to ensure their issues are resolved or to provide status updates on when their issues will be fixed.
Required Skills & Experience1-2 years of IT experience -- geek squad, internship or corporate experience4 years bachelor's degreeCustomer service skillsMUST BE WITHIN DRIVING DISTANCE TO MERCHANTVILLE, NJ
Nice to Have Skills & ExperienceExperience supporting and troubleshooting MSOfficeExperience using Okta single sign onExperience using JIRA ticketing system
Compensation:Exact compensation may vary based on several factors, including skills, experience, and education. Benefit packages for this role will start on the 31st day of employment and include medical, dental, and vision insurance, as well as HSA, FSA, and DCFSA account options, and 401k retirement account access with employer matching. Employees in this role are also entitled to paid sick leave and/or other paid time off as provided by applicable law.",23.0,HOURLY,United States,11056.0,92.0,,16.0,Contract,20.0,1713213290000.0,1.0,https://www.linkedin.com/jobs/view/3898170701/?trk=jobs_biz_prem_srch,,ComplexOnsiteApply,1715805289000.0,,Associate,,1713213290000.0,,0,CONTRACT,USD,BASE_SALARY,40560.0,,
3106,IT System Data Services,3904707398,Ztek Consulting,Market Leader Life Sciences,"Job Description:You will be part of the TCS Intelligent Life Sciences Operations market team and play a key role in delivering and growing the business to the mission. The strategic focus of the business is to enable our clients to their goals and imperatives in enabling patient care with science, technology and operations with cost, experience and outcomes-based leadership. . You will be part of the core team working on enabling pharma business to leapfrog in capabilities with fast, contextual, connected, transparent, and employee empowered operations, powered by data, AI and technology, human augmented operating model. You will be a member of the core market team, building and accelerating our go-to-market as AI-powered business operations working across strategy, offerings, opportunity creation, and conversion, delivering exceptional value to our clients and growing the business for the practice. You will engage with the senior leadership, account, and sales teams to shape and innovate offerings and solutions that deliver to the payers’ strategic objectives. You will also partner with solution build teams and develop capabilities, prototypes, and collateral for the demonstration and execution of the solutions.Working with Account, Sales teams develop strategic opportunities in pharma companies and lead strategy and solution workshops with the clients, demonstrating the impact and value. You will build trusted relationships with customer executives, partner with sales leaders and account teams, and be a significant contributor to the revenue growth in our accounts and prospects. As part of the core market team, you will help create and drive the Go to Market strategic business plan with clear pathways to revenue targets across target account strategies, industry solutions, partnerships, and marketing. 
Qualifications:Deep operations, solutions, sales leadership, with over 15 years’ experience in large Service Providers/Pharma/CROs, across core processes in Life Sciences Operations, including clinical operations, clinical data management, Safety Pharmacovigilance, Regulatory Reporting, Medical Writing, Bio Stats, Patient support and other areas, Demonstrated ability to leverage technology, data, analytics, RPA, and AI and make operations intelligent, automated, and autonomous. Delivered business and cost outcomes including significantly reduced manual efforts, lowering the risks and penalties, and increasing customer experience and engagement. Delivered outstanding results in a challenging environment, demonstrating accountability with a strong sense of ownership. Strong entrepreneurial mindset and ability to create and build businessDeveloped sustained and trusted partnerships with clients, passion for building relationships with account, sales, and other teams in the company.Demonstrated ability to bring together best of the company’s capabilities for solutions and offerings delivering to client goals and outcomes. Strong executive presence and communication skills. Ability to build executive-level presentations and present them to an executive audiencePost Graduate in any discipline. Location – anywhere in the US, preferably North East",,,"New York, NY",331509.0,,,,Full-time,,1713561811000.0,,https://www.linkedin.com/jobs/view/3904707398/?trk=jobs_biz_prem_srch,,ComplexOnsiteApply,1716153811000.0,,Mid-Senior level,,1713561811000.0,,0,FULL_TIME,,,,10001.0,36061.0
3106,IT System Data Services,3903433172,Wave Talent,Technical Account Manager,"Senior Technical Account Manager We are seeking a Senior Technical Account Manager to play a pivotal role in guiding our client's largest Enterprise customers to optimize their utilization of our platform, ensuring they attain the expected value. In this position, you will act as the primary liaison between our clients and internal teams, championing customer needs while fostering cohesion across various departments including Customer Engineering, Deployment Engineering, Sales, Marketing, and Product Development.
🏠 Location - Remote (North America - East Coast) 💰 Compensation - Up to $175K Base + $50K Bonus + Equity + Benefits 
Responsibilities:Guide Enterprise clients in accelerating their adoption of our platform, ensuring they achieve anticipated value.Advocate for clients internally, representing their interests when collaborating with different teams and partners.Drive alignment across departments to ensure seamless customer experience and product enhancement.
Requirements:4+ years of experience directly engaging with customers and partners in domains such as data science, machine learning, or data management (e.g., big data analytics, data integration, major cloud platforms like AWS, GCP, Azure).4+ years of people management experience in customer success, technical consulting, professional services, or similar customer-facing roles.Proven track record in managing customer portfolios to drive product adoption or delivering complex customer projects.",180000.0,YEARLY,United States,37197612.0,21.0,,160000.0,Full-time,11.0,1713449910000.0,1.0,https://www.linkedin.com/jobs/view/3903433172/?trk=jobs_biz_prem_srch,,ComplexOnsiteApply,1716041910000.0,,Mid-Senior level,,1713449910000.0,,0,FULL_TIME,USD,BASE_SALARY,170000.0,,
3106,IT System Data Services,3884429793,Golden Technology,Java Technical Lead,"Job DescriptionPosition Summary:The Services Tech Lead will participate in activities that guide the direction, development, and delivery of software solutions that meet business needs. The Services Tech Lead will complete analysis and design tasks required to deliver critical business solutions. This role will establish estimates and work plans for design, development, implementation, and rollout tasks. The Services Tech Lead will communicate with the appropriate teams to ensure that assignments are delivered with the highest quality and in accordance with standards. This role will be adding functionality to existing applications as well as developing new applications that will monitor freshness delivered by stores. This role will be expected to demonstrate the core values of respect, honesty, integrity, diversity, inclusion, and safety. This Services Tech Lead role is with the Supply Chain Fresh team.
Minimum Position Qualifications:
• 8+ years of experience in systems analysis, design or programming and the associated development methodologies. • 8+ years of experience coding in Java • 7+ years of experience developing RESTful APIs• Experience with designing, building and releasing APIs• Familiarity with cloud message APIs and push notifications.• 4+ years of experience with continuous integration and automated testing integration• Strong knowledge of SQL.• Proficient understanding of code versioning tools, such as Git, GitHub SaaS• Ability to understand business requirements and translate them into technical requirements.• Ability to interact well in a team environment• Proven communication skills to effectively communicate information to team members• Experience with developing services on a cloud platform such as Microsoft Azure• Experience with modern libraries and tooling• Significant experience with the Spring Framework (Persistence, REST, Messaging, Integrations) such as Spring Boot• Significant experience on core features of Spring such as Dependency Injection and Aspect-Oriented Programming, Spring Security etc.• Significant knowledge of SQL Database and NoSQL Databases• Proven Experience working with Docker or similar technologies, GIT, CI/CD and writing unit/integration tests Key ResponsibilitiesEssential Job Functions:• Provide application designs and lead design discussions, execute development against design, and a navigate complex codebase• Complete estimates and work plan as appropriate for design, development, implementation, and rollout• Create technical system documentation and ensure that this documentation remains current• Participate in the analysis of the technology environment to detect critical deficiencies and recommend solutions for improvement• Promote the capture and reuse of intellectual capital, including code objects and components• Support and maintain applications utilizing required tools and technologies. Provide support for applications, including involvement with the Support Center, Networking and Infrastructure teams, and vendors as appropriate• Participate in on-call rotation",,,"Cincinnati, OH",2678950.0,59.0,,,Contract,15.0,1712347325000.0,,https://www.linkedin.com/jobs/view/3884429793/?trk=jobs_biz_prem_srch,,ComplexOnsiteApply,1714939325000.0,,Mid-Senior level,,1712347325000.0,,0,CONTRACT,,,,45202.0,39061.0
3106,IT System Data Services,3899541392,Radiansys Inc.,".Net UI Developer(AZURE)/Cambridge, MA-Onsite","Hi
We are looking for Sr App Dev Consultant/Cambridge, MA-Onsite. Anyone interested can share your resume at pkumar@radiansys.com

Title: Sr App Dev Consultant/Cambridge, MA-Onsite.Net UI Developer(AZURE)/Cambridge, MA-OnsiteLocation: Cambridge, MA OnsiteFull time Hire USC / GC / GC EAD only 

Technical Architect:1. Experience in building the Application/Infra Architecture with Azure2. Experience with different Azure services3. Experience & Understanding on Microsoft Fabric, Copilot, Gen AI and IoT4. Experience in .Net /.Net Core REST APIs5. Experience in building UI with Angular/React6. Azure DEV Ops understanding and handling the Agile scrum meetings, Building CI/CD pipelines7. Design, Solutioning and Documentation

Regards,Pinku Kumar Talent Acquisition – Radiansys Inc.39510 Paseo Padre Pkwy #110, Fremont, CA 94538Direct: 510 790 2000 Ext 1006Email: pkumar@radiansys.com",,,"Cambridge, MA",537246.0,12.0,,,Full-time,3.0,1713280804000.0,,https://www.linkedin.com/jobs/view/3899541392/?trk=jobs_biz_prem_srch,,ComplexOnsiteApply,1715872803000.0,,Mid-Senior level,,1713280804000.0,,0,FULL_TIME,,,,2138.0,25017.0
3106,IT System Data Services,3901967220,Suretouchleads,Enterprise Platform Solution Architect,"Greetings,Please share your updated resume if you are interested in the below-mentioned role.
Position: Enterprise Platform Solution ArchitectLocation: Cleveland, OH Type: Full-time
JOB DESCRIPTION:The ideal candidate must have an in-depth understanding of architectural patterns, principles, and frameworks, and be well-versed in key technology platforms, infrastructure, database, security, legal compliance rules and software platforms. The incumbent should have strong understanding of the technical architecture of the packaged solutions such as Oracle ERP, Oracle SaaS Fusion cloud, Coupa, Salesforce etc. The Enterprise Platform Solution Architect will provide technical leadership and influence strategic decision-making in support of the Architecture practice which in turn supports and enables business goals.This position requires an individual who is highly motivated and committed to providing exceptional technical solutions, architecture, and collaboration. This role requires someone who is passionate about technology and has a track record of delivering high-quality solutions in a fast-paced environment.RESPONSIBILITIES:Essential FunctionsStrategy & Planning• Develop high-level and detailed solution architecture designs, including technical specifications and implementation plans.• Accountable for technical decisions, documentation and direction for high-level designs, and approaches.• Provide solution that is based on Reference Digital Integration Layer (Digital Integration Hub) that ties together the Experience Layer, Microservices, Event-based integration, Data management (data streaming), and the system of record applications and data such as Oracle EBS, Oracle Cloud, other ERPs, and other large enterprise applications across the globe.• Responsible for design of Microservices Technology platforms with a strong focus on reusability.• Conduct proof-of-concept, pilot on the latest trends and advancements in digital transformation and apply them to the organization's technology strategy.• Ensure the security, scalability, and reliability of technology solutions, and address any potential risks or issues that may impact business operations.• Provide gap, risk and impact analysis.• Work with IT/technology owners to identify and address operational impact and lower the total cost of ownership for IT capabilities.• Conduct regular assessments of the technology architecture to identify areas for improvement and make recommendations to Platform Engineering leadership.• Work closely across technology organizations to identify, architect and design foundational technology capabilities that will set the base for our Digital transformation initiatives across product development and Integration.• Identify solution accelerators for various Enablement teams (Microservices , Digital Integration Layer, Lowcode/Nocode, DevOps etc.) to increase adoption of modernization.• Collaborate with cross-functional teams, including developers, UX, data analysts, product owners, and business analysts to design and implement scalable, high-performing solutions.• Partner with key stakeholders across Enterprise Architecture, Product teams to understand the Business Transformation roadmap especially around newer cloud solutions such as Oracle SaaS, HighRadius, etc. and identify opportunities to improve processes and workflows through technology solutions.Acquisition & Deployment• Monitor and manage the performance of deployed technologies and software products, ensuring that they meet agreed-upon service level agreements (SLAs).• Work independently and hands-on to prototype.• Develop and maintain technical documentation and standard operating procedures (SOPs) for the deployment and operation of new technologies and software products.• Identify and mitigate risks associated with the deployment of new technologies and software products, ensuring that security and compliance requirements are met.Operational Management• Establish and maintain a culture of continuous improvement, including implementing metrics to measure the effectiveness of the technology architecture and identifying areas for improvement.• Develop solutions to support cybersecurity strategies to protect the organization from internal and external threats.• Oversee the deployment of new technology solutions and ensuring that they are integrated seamlessly with existing systems and processes.• Continuously evaluate and improve operational processes to enhance efficiency and reduce risk.Incidental Functions• Participate in internal and external committees, working groups, and other forums to share knowledge, promote best practices, and drive improvements in technical solutions.• Conduct training sessions, workshops, and other educational activities to share knowledge and improve technical skills among team members and other stakeholders.• Participate in hiring and talent management processes to identify and recruit top talent, as well as develop and retain existing team members.• Serve as a mentor to technical staff, providing guidance, feedback, and support to help them develop their skills and achieve their professional goals.
QUALIFICATIONSRequirementsFormal Education & Certification• Bachelor's degree (or foreign equivalent) in a Computer Science, Computer Engineering, or Information Technology field of study (e.g., Information Technology, Electronics and Instrumentation Engineering, Computer Systems Management, Mathematics) or equivalent experience.Knowledge & Experience• 10+ years of IT experience• 8+ years of experience in solution architecture and architectural frameworks, including the creation of current, transitional, and future state architectures.• 8+ years of experience in Java/Spring Boot, or similar platforms or frameworks in a service-oriented environment• Good experience with modern product development and Integration architectures• In-depth understanding of architectural patterns, principles, and frameworks.• Experience in Domain Driven Design.• Strong technical background in key technology platforms, infrastructure, database, security, legal compliance rules, and software platforms• Experience with containers and orchestration platforms (Kubernetes, Docker Enterprise) in the public/hybrid cloud model• Experience with Azure platform and services offered by Azure cloud platform.• Experience in Solutioning digital products using PowerApps platform, ReactJS, Java spring boot, docker, Kubernetes etc.• 8+ Experience in Microservices, Event-based integration layer, and data management layer.• Should have zero distance to code and be able review the detailed design, code, configuration, data model and provide specific inputs to the developers.• Experience of building products & services in ""As a Service” models (e.g., SaaS, IaaS, PaaS) and platforms (e.g., AWS, Azure)• Extensive experience working with Cloud and Enterprise Middleware technologies, architectures, programming systems, and models, ideally in a product company building large Enterprise software suites and solutions.Preferred Experience• Experience with DevOps and Agile engineering practices• Experience with routing and messaging tools / patterns• 8+ years collaborating with internal clients and/or external agencies/partners.• Ability to develop process flow-based data and software architectures - designing process and data flows that are aligned with product processes and information systems.• Agile product development experience utilizing Scrum or Kanban.• Experience with Agile tool is a plus.Personal Attributes• High credibility with leadership, while also able to connect and build trust-based relationships with stakeholders at all levels of the organization.• Ability to focus/align the organization around critical initiatives, policies, and best practices.• Strong customer orientation.• Strong written and oral communication skills.• A proven track record of setting and meeting aggressive goals and action plans, both as an individual and with a team• Commitment to fostering a culture of inclusion and diversity.• Effective leadership skills. These include team building, consensus building, the ability to balance team and individual responsibilities, and achieving goals through others not directly under the leader's supervision, by working ethically and with integrity.• Excellent listening, interpersonal, written, collaboration, and oral communication skills. These skills will be used to explain digital concepts and technologies to business leaders, and business concepts to technologists; the ability to present and explain technical information in a way that establishes rapport, persuades others, and gains understanding, and to sell ideas and processes internally at all levels.• Proven analytical and problem-solving abilities.• Attentive to detail with a focus on multitasking and the application of resources• required to achieve goals.• Strong commitment to inclusion and diversity.",150.0,YEARLY,"Cleveland, OH",77770138.0,4.0,,140.0,Full-time,,1713479378000.0,,https://www.linkedin.com/jobs/view/3901967220/?trk=jobs_biz_prem_srch,,ComplexOnsiteApply,1716071378000.0,,Mid-Senior level,,1713479378000.0,,0,FULL_TIME,USD,BASE_SALARY,145.0,44102.0,39035.0
